{
    "$schema": "http://json-schema.org/schema#",
    "properties": {
        "base_happiness": {
            "type": "integer"
        },
        "capture_rate": {
            "type": "integer"
        },
        "color": {
            "properties": {
                "name": {
                    "type": "string"
                },
                "url": {
                    "type": "string"
                }
            },
            "required": [
                "name",
                "url"
            ],
            "type": "object"
        },
        "egg_groups": {
            "items": {
                "properties": {
                    "name": {
                        "type": "string"
                    },
                    "url": {
                        "type": "string"
                    }
                },
                "required": [
                    "name",
                    "url"
                ],
                "type": "object"
            },
            "type": "array"
        },
        "evolution_chain": {
            "properties": {
                "url": {
                    "type": "string"
                }
            },
            "required": [
                "url"
            ],
            "type": "object"
        },
        "evolves_from_species": {
            "anyOf": [
                {
                    "type": "null"
                },
                {
                    "properties": {
                        "name": {
                            "type": "string"
                        },
                        "url": {
                            "type": "string"
                        }
                    },
                    "required": [
                        "name",
                        "url"
                    ],
                    "type": "object"
                }
            ]
        },
        "flavor_text_entries": {
            "items": {
                "properties": {
                    "flavor_text": {
                        "type": "string"
                    },
                    "language": {
                        "properties": {
                            "name": {
                                "type": "string"
                            },
                            "url": {
                                "type": "string"
                            }
                        },
                        "required": [
                            "name",
                            "url"
                        ],
                        "type": "object"
                    },
                    "version": {
                        "properties": {
                            "name": {
                                "type": "string"
                            },
                            "url": {
                                "type": "string"
                            }
                        },
                        "required": [
                            "name",
                            "url"
                        ],
                        "type": "object"
                    }
                },
                "required": [
                    "flavor_text",
                    "language",
                    "version"
                ],
                "type": "object"
            },
            "type": "array"
        },
        "form_descriptions": {
            "items": {
                "properties": {
                    "description": {
                        "type": "string"
                    },
                    "language": {
                        "properties": {
                            "name": {
                                "type": "string"
                            },
                            "url": {
                                "type": "string"
                            }
                        },
                        "required": [
                            "name",
                            "url"
                        ],
                        "type": "object"
                    }
                },
                "required": [
                    "description",
                    "language"
                ],
                "type": "object"
            },
            "type": "array"
        },
        "forms_switchable": {
            "type": "boolean"
        },
        "gender_rate": {
            "type": "integer"
        },
        "genera": {
            "items": {
                "properties": {
                    "genus": {
                        "type": "string"
                    },
                    "language": {
                        "properties": {
                            "name": {
                                "type": "string"
                            },
                            "url": {
                                "type": "string"
                            }
                        },
                        "required": [
                            "name",
                            "url"
                        ],
                        "type": "object"
                    }
                },
                "required": [
                    "genus",
                    "language"
                ],
                "type": "object"
            },
            "type": "array"
        },
        "generation": {
            "properties": {
                "name": {
                    "type": "string"
                },
                "url": {
                    "type": "string"
                }
            },
            "required": [
                "name",
                "url"
            ],
            "type": "object"
        },
        "growth_rate": {
            "properties": {
                "name": {
                    "type": "string"
                },
                "url": {
                    "type": "string"
                }
            },
            "required": [
                "name",
                "url"
            ],
            "type": "object"
        },
        "habitat": {
            "anyOf": [
                {
                    "type": "null"
                },
                {
                    "properties": {
                        "name": {
                            "type": "string"
                        },
                        "url": {
                            "type": "string"
                        }
                    },
                    "required": [
                        "name",
                        "url"
                    ],
                    "type": "object"
                }
            ]
        },
        "has_gender_differences": {
            "type": "boolean"
        },
        "hatch_counter": {
            "type": "integer"
        },
        "id": {
            "type": "integer"
        },
        "is_baby": {
            "type": "boolean"
        },
        "name": {
            "type": "string"
        },
        "names": {
            "items": {
                "properties": {
                    "language": {
                        "properties": {
                            "name": {
                                "type": "string"
                            },
                            "url": {
                                "type": "string"
                            }
                        },
                        "required": [
                            "name",
                            "url"
                        ],
                        "type": "object"
                    },
                    "name": {
                        "type": "string"
                    }
                },
                "required": [
                    "language",
                    "name"
                ],
                "type": "object"
            },
            "type": "array"
        },
        "order": {
            "type": "integer"
        },
        "pal_park_encounters": {
            "items": {
                "properties": {
                    "area": {
                        "properties": {
                            "name": {
                                "type": "string"
                            },
                            "url": {
                                "type": "string"
                            }
                        },
                        "required": [
                            "name",
                            "url"
                        ],
                        "type": "object"
                    },
                    "base_score": {
                        "type": "integer"
                    },
                    "rate": {
                        "type": "integer"
                    }
                },
                "required": [
                    "area",
                    "base_score",
                    "rate"
                ],
                "type": "object"
            },
            "type": "array"
        },
        "pokedex_numbers": {
            "items": {
                "properties": {
                    "entry_number": {
                        "type": "integer"
                    },
                    "pokedex": {
                        "properties": {
                            "name": {
                                "type": "string"
                            },
                            "url": {
                                "type": "string"
                            }
                        },
                        "required": [
                            "name",
                            "url"
                        ],
                        "type": "object"
                    }
                },
                "required": [
                    "entry_number",
                    "pokedex"
                ],
                "type": "object"
            },
            "type": "array"
        },
        "shape": {
            "properties": {
                "name": {
                    "type": "string"
                },
                "url": {
                    "type": "string"
                }
            },
            "required": [
                "name",
                "url"
            ],
            "type": "object"
        },
        "varieties": {
            "items": {
                "properties": {
                    "is_default": {
                        "type": "boolean"
                    },
                    "pokemon": {
                        "properties": {
                            "name": {
                                "type": "string"
                            },
                            "url": {
                                "type": "string"
                            }
                        },
                        "required": [
                            "name",
                            "url"
                        ],
                        "type": "object"
                    }
                },
                "required": [
                    "is_default",
                    "pokemon"
                ],
                "type": "object"
            },
            "type": "array"
        }
    },
    "required": [
        "base_happiness",
        "capture_rate",
        "color",
        "egg_groups",
        "evolution_chain",
        "evolves_from_species",
        "flavor_text_entries",
        "form_descriptions",
        "forms_switchable",
        "gender_rate",
        "genera",
        "generation",
        "growth_rate",
        "habitat",
        "has_gender_differences",
        "hatch_counter",
        "id",
        "is_baby",
        "name",
        "names",
        "order",
        "pal_park_encounters",
        "pokedex_numbers",
        "shape",
        "varieties"
    ],
    "type": "object"
}